{
  "$schema": "https://memory-os.example/schemas/memory-town/scene-composition-case.v2.schema.json",
  "caseId": "scene-composition.non-shrinking-growth-v2",
  "caseVersion": 2,
  "references": {
    "featureRegistry": "feature-registry.v2.json",
    "mapDefinition": "map-definition.main-island.v1.json",
    "objectCatalog": "object-catalog.v1.json",
    "layoutTemplate": "layout-template.main-island.v1.json"
  },
  "input": {
    "layout": {
      "layoutId": "layout-fixture-user-001",
      "layoutRevision": 1,
      "templateId": "memory-town.main-island.default",
      "templateVersion": 1
    },
    "featureProjection": [
      {
        "featureId": "shelf.movie",
        "currentEligibleItemCount": 0,
        "growthEligibleContributionCount": 0,
        "projectionCursor": "cursor.movie.120",
        "recentDelta": -8,
        "candidateStage": 0,
        "badges": [],
        "route": "/shelves/movies"
      },
      {
        "featureId": "shelf.story",
        "currentEligibleItemCount": 18,
        "growthEligibleContributionCount": 18,
        "projectionCursor": "cursor.story.44",
        "recentDelta": 4,
        "candidateStage": 2,
        "badges": ["continued"],
        "route": "/shelves/stories"
      }
    ],
    "featureProgress": [
      {
        "featureId": "shelf.movie",
        "maxUnlockedStage": 2,
        "unlockedAtByStage": {
          "1": "2026-01-10T00:00:00Z",
          "2": "2026-05-01T00:00:00Z"
        },
        "growthRulesetVersion": "memory-town-growth-rules/2.0.0",
        "resetEpoch": 0,
        "growthOriginCursor": "cursor.movie.0",
        "updatedAt": "2026-07-13T00:00:00Z"
      },
      {
        "featureId": "shelf.story",
        "maxUnlockedStage": 1,
        "unlockedAtByStage": {
          "1": "2026-04-01T00:00:00Z"
        },
        "growthRulesetVersion": "memory-town-growth-rules/2.0.0",
        "resetEpoch": 0,
        "growthOriginCursor": "cursor.story.0",
        "updatedAt": "2026-07-13T00:00:00Z"
      }
    ],
    "environment": {
      "themeId": "town-theme.default",
      "seasonMode": "auto",
      "effectiveSeason": "autumn",
      "timeMode": "night",
      "weatherVisual": "clear",
      "motionLevel": "reduced",
      "soundEnabled": false
    }
  },
  "expected": {
    "displayStages": [
      {
        "featureId": "shelf.movie",
        "currentEligibleItemCount": 0,
        "growthEligibleContributionCount": 0,
        "candidateStage": 0,
        "previousMaxUnlockedStage": 2,
        "displayStage": 2,
        "unlockEvent": false
      },
      {
        "featureId": "shelf.story",
        "currentEligibleItemCount": 18,
        "growthEligibleContributionCount": 18,
        "candidateStage": 2,
        "previousMaxUnlockedStage": 1,
        "displayStage": 2,
        "unlockEvent": true
      }
    ],
    "unlockEvents": [
      {
        "featureId": "shelf.story",
        "fromStage": 1,
        "toStage": 2,
        "expectedResetEpoch": 0,
        "expectedGrowthOriginCursor": "cursor.story.0",
        "projectionCursor": "cursor.story.44"
      }
    ],
    "renderedStructures": [
      {
        "instanceRef": "seed:structure-cinema-main",
        "featureId": "shelf.movie",
        "variantKey": "stage-2",
        "route": "/shelves/movies"
      },
      {
        "instanceRef": "seed:structure-story-house-main",
        "featureId": "shelf.story",
        "variantKey": "stage-2",
        "route": "/shelves/stories"
      }
    ],
    "environment": {
      "themeId": "town-theme.default",
      "seasonMode": "auto",
      "effectiveSeason": "autumn",
      "timeMode": "night",
      "weatherVisual": "clear",
      "motionLevel": "reduced",
      "soundEnabled": false
    },
    "privacyAssertions": {
      "forbiddenKeys": ["title", "personName", "rawNote", "privateUrl", "preciseLocation", "chatBody"],
      "rawMemoryRecordCount": 0
    }
  }
}
